{
  "schema_version": "pdx_dynamic_dispatch_receipt_v1",
  "receipt_id": "dispatch_receipt_001",
  "activation_request_id": "activation_request_001",
  "authoritative_activation_id": "activation_001",
  "workflow_job_id": "workflow_dispatch_001",
  "workflow_step_id": "step_dispatch_001",
  "dispatch_attempt_id": "dispatch_attempt_001",
  "run_b_id": "run_execution_001",
  "run_b_plan_digest": "aaaaaaaaaaaaaaaaaaaaaaaaaaaaaaaaaaaaaaaaaaaaaaaaaaaaaaaaaaaaaaaa",
  "idempotency_key_digest": "bbbbbbbbbbbbbbbbbbbbbbbbbbbbbbbbbbbbbbbbbbbbbbbbbbbbbbbbbbbbbbbb",
  "idempotency_binding_digest": "cccccccccccccccccccccccccccccccccccccccccccccccccccccccccccccccc",
  "dispatch_policy_id": "policy_dispatch_001",
  "policy_revision_epoch": 1,
  "policy_digest": "df78dc90a572d00b9cd0e2245ae3e5ad64a6a008af77efbbf530944201e33a31",
  "allowed_tool_names_digest": "2e746ba7b2bb76facbf07e88a4ed28ec0655e9b492e8c61b9c1e561b0be70d8a",
  "frozen_tool_definitions_digest": "587544bf89a45097a2310b6d78ec8796bce830126772722f983310c5b79af1e8",
  "resolved_tool": "calc",
  "arguments_digest": "b5dc728aec363b174c1105a169127a89409b135594594a749fc67e2c2deecbd8",
  "status": "completed",
  "error_code": null,
  "execution_occurred": true,
  "input_schema_verified": true,
  "output_schema_verified": true,
  "receipt_cas_published": true,
  "executor_output_artifacts_published": true,
  "artifact_identities": [],
  "reconciliation_required": false,
  "recorded_at": "2026-10-03T12:03:00Z",
  "receipt_digest": "451732d45886b782bc05420c501f3d206d4eb2c203d943812bb7d6e1a4fceeb0"
}
